병명,정의,원인,증상,진단,치료
간농양,"간농양이란 세균이나 기생충이 간에서 증식하여 농양(고름 덩어리)을 형성하여 질병을 일으키는 것을 말합니다. 피부나 근육 등 신체 외부에서 발생한 농양은 그것을 터트려 배액과 소독을 하고 항생제를 투여하면 치료가 가능합니다. 그러나 간처럼 신체 내부에서 발생한 농양은 육안으로 확인할 수 있는 방법이 없습니다. 피부 등에 발생한 농양은 피부의 발적, 부종 등을 육안으로 확인할 수 있으나 간과 같은 신체 내부 장기에 발생한 농양은 발열, 몸살과 같은 감기 증상, 염증성 증상으로 나타날 수 있습니다. 때로는 상복부 통증처럼 위염 증상으로 나타날 수 있어 확인이 어렵습니다. 간농양의 증상이 비특이적이기 때문에 진단이 늦어 적절한 치료 시기를 놓치게 되면 패혈증, 복막염 등으로 사망할 수 있는 위험한 질환이므로 빠른 진단과 치료가 중요합니다. 하지만 조기진단 및 적절한 배농 치료와 함께 항생제를 병용하면 비교적 기대되는 치료 결과가 좋습니다.","간농양은 발생 원인에 따라 크게 화농성 간농양과 기생충성(아메바성) 간농양으로 구분합니다. 화농성 간농양은 세균이 원인이고 그중에서 클렙시엘라균(Klebsiella pneumonia)에 의한 것이 전체의 약 80%에 해당합니다. 기생충성(아메바성) 간농양은 아메바(Entameoba histolytica)에 의해 발생하며, 국내의 경우 과거 위생 상태가 좋지 못했을 때는 흔하였지만 1990년대 이후에는 국내에서 발생 보고가 거의 없습니다. ","화농성 간농양이 생기면 세균 또는 기생충에 의한 간내 고름 형성과 이로 인한 염증으로 인해 다양한 임상적 증상과 증후가 나타나게 됩니다. ? 발열(90%) ? 복부 통증 및 압통(55~74%) ? 오한(38~49%) ? 식욕부진(38%) ? 체중감소(25~43%) ? 구역과 구토(28~43%) ? 허약감과 권태감(30%) 상복부를 눌렀을 때 통증이 있으며 간이 커져 있거나 황달(빌리루빈이라는 색소가 피부에 침착되어 얼굴이나 몸이 노랗게 되는 것)이 나타나기도 합니다. 대개 2주 이내에 이런 증상이 나타나지만, 어떤 경우에는 5~6개월 후에 증상이 나타나기도 합니다. 아메바성 간농양의 증상과 증후도 화농성 간농양과 거의 비슷합니다. 화농성 간농양보다는 증상이 약간 덜하며 발열 및 오한, 무기력, 구역 및 구토, 식욕 부진, 체중감소 등을 보일 수 있습니다. 일부 환자는 가슴에 통증을 느끼거나 기침, 호흡 곤란 등을 호소하기도 합니다. 설사가 있는 경우는 20% 전후로 흔하지 않습니다. 간이 커져 있거나 오른쪽 상복부를 눌렀을 때 통증이 있기도 합니다. 황달은 화농성 간농양에 비해 다소 적어 5~8% 정도에서 나타납니다. ","간농양 의심 증상으로 병원에 오게 되면 의사는 자세한 문진과 신체검사를 시행하여 증상을 평가한 후에 혈액검사, 간 초음파, 복부 전산화 단층촬영(CT) 등 필요한 검사를 시행하게 됩니다. 1. 문진 증상의 발현시기와 심한 정도, 과거 병력(간염, 담석증, 암, 당뇨 등), 일반적 건강 상태, 여행경력, 거주지 파악 등 전반적 내용을 확인합니다. 2. 신체검사 간은 복부의 오른쪽 상부에 위치하기 때문에 환자가 이곳에 통증을 호소하는 경우도 있습니다. 그러나 이러한 복부 통증이 없는 경우도 있습니다. 이때 의사가 촉진하여 우상복부에 압통(눌렀을 때 통증이 발생하는 것)이 있게 되면 이것이 진단의 단서가 될 수 있습니다. 3. 혈액검사 간농양 환자에게 시행하는 혈액검사로는 염증 수치 검사와 간기능 검사, 간농양과 관련이 있는 질병에 대한 검사(간염, 간암, 담도계 이상 등)가 있습니다. 하지만 혈액검사의 이상은 간농양 환자에서 특이적이지 않습니다. 백혈구 증가(80% 이상)와 혈청 알칼리 인산분해효소의 증가(60% 이상)가 가장 흔하게 나타나고 그 외에 저알부민혈증, 간 효소(ALT/AST)증가, 빌리루빈 증가가 관찰됩니다.  4. 세균학적 검사 화농성 간농양의 원인 균주는 다양하고 때로는 감염의 경로를 반영합니다. 세균은 크게 산소가 있는 환경에서 증식하는 호기성균과, 반대로 산소가 없는 환경에서 자라는 혐기성균으로 분류되는데 화농성 간농양에서는 대부분 통성 호기성균과 혐기성균이 혼합된 경우가 많습니다. 고름을 빼내어 세균의 존재 여부를 확인하는데, 배농액에서의 배농액 양성률은 41.4~51%이고 혈액배양에서의 세균 양성률은 13.5~59.5%입니다. 현미경 검사를 위해 세균을 염색할 때, 호기성균은 그람(Gram)양성과 음성으로 분류하게 되는데, 화농성 간농양에서 그람음성균주가 70% 이상으로 가장 흔하게 발견됩니다. 그 중 클렙시엘라균(Klebsiella pneumonia)이 가장 흔한 화농성 간농양의 원인균주로 보고되고 있습니다. 아메바성 간농양의 경우 화농성 간농양에서 진단하는 방법을 그대로 사용합니다. 추가로 혈액학적 기생충 검사를 시행합니다. 대변에서 아메바를 발견할 확률은 15% 정도로 낮으며 간접 적혈구응집 검사 (indirect hemagglutination assay)를 시행하면 95% 이상 확진이 가능합니다. 그러나 발병 1주 동안은 음성인 경우가 많으며, 결과가 나오는데 24~48시간이 걸립니다. 따라서 경험적인 치료를 시작하고 그 결과를 기다려야 합니다. 5. 영상학적 검사 간농양의 진단에서 복부 초음파 검사, 복부 전산화 단층촬영(CT)이 필수적입니다. 담도 조영술이나 내시경적 검사도 필요에 따라 시행하게 됩니다. 영상학적 검사에서 간농양은 간낭종이나 간암 등과 감별이 필요합니다. 구별이 어려운 경우에는 혈액학적 방법, 세균학적 방법, 배액과 조직검사, 암표지자 등의 검사가 필요한 경우도 있습니다. 영상학적 검사를 통해 간농양의 크기, 위치, 모양, 개수 , 공기 방울 형성 유무, 배액 가능 여부, 동반질환(간암, 담도계 이상) 등을 파악할 수 있어 진단, 치료, 예후 등에 중요한 정보를 제공합니다.     6. 병리학적 소견 간농양은 크기가 수 mm에서 수 cm까지 다양하며, 한 개 또는 여러 개의 병변을 만듭니다. 간 문맥, 간 동맥 혹은 담관을 통해서 파급된 농양은 다수의 작은 농양을 만들고, 직접 간실질로 침투되는 경우에는 하나의 큰 농양을 만듭니다. 병리조직 소견은 다른 부위에서 발생하는 화농성 농양과 같이, 간실질이 화농성 삼출액으로 대치되며 급성 또는 만성 염증세포들이 주위에 침윤하고 있는 양상을 보입니다. 농양의 가장자리에 형성된 육아조직은 시일이 경과하면 캡슐로 나타납니다. ","화농성 간농양의 성공적인 치료를 위해 일반적으로 항생제 치료와 배액 모두가 필요합니다. 하지만 영상학적 검사를 통해 배액이 가능한지 파악해야 하고 간암, 담석, 담도계 이상 등 동반질환이 있는 경우 동반질환에 대한 치료 또한 시행되어야 합니다. 간농양의 치료는 개개인에 따라 다르고 개수에 따라 또는 원인 질환이 무엇인지에 따라 다릅니다. 치료법으로는 항생제 치료, 경피적 배액술, 외과적 배액 또는 절제술 등이 있습니다.     치료 시 결과가 좋지 않을 것으로 예상되는 경우는, ? 70세 이상 고령 ? 다발성 간농양 ? 담도계 질환으로 간농양이 발생한 경우 ? 악성 종양이 동반된 경우 ? 혈청 알부민이 낮은 경우 ? 농양의 크기가 10 cm 이상인 경우 ? 농양 내에 공기가 존재하는 경우 등이 있습니다. 항생제 치료 일반적으로 배액 없이 치료받은 환자들이 더 오랜 기간 동안 항생제 치료를 받습니다. 장기간 항생제를 치료할 경우 항생제 내성문제가 발생할 수 있고 세균 확인 없이 경험적 항생제로 치료하는 경우 항생제 남용문제 뿐만 아니라 패혈증으로 진행할 수 있는 위험성이 있습니다. 따라서 배액과 함께 항생제를 투여하는 것이 이상적인 치료 방법입니다. 화농성 간농양의 항생제 치료 기간은 대개 최소 4주에서 6주 정도입니다. 주사용 항생제는 첫 2~3주 혹은 적절한 임상적 반응이 있을 때까지 투여하고 남은 기간은 경구용 항생제로 치료합니다. 기생충성 간농양의 경우 메트로니다졸(metronidazole)을 7~10일간 투여합니다. 이러한 치료로 90% 이상의 완치율을 기대할 수 있습니다. 1. 배액 치료 배액하는 방법에는 경피적 배액술이 가장 많이 사용됩니다. 경피적 배액술이란 피부를 통하여 바늘이나 배액관을 삽입하여 농양을 피부 밖으로 빼내는 시술을 말합니다. 경피적 배액에는 바늘을 삽입하는 세침흡인법과 배액관을 삽입하는 방법이 있습니다. 간농양의 직경이 5cm 이하면 세침흡인법을 우선 고려하고, 직경이 5cm 이상이면 배액관을 삽입하는 방법이 좋습니다. 배액관을 삽입한 경우 배액되는 양이 적어질 때까지 삽입하고 있다가 제거하면 됩니다. 보통 배액관 삽입 후 일주일 정도면 배액되는 양이 확연히 줄어들게 됩니다. 이 배액술은 전신 마취가 필요 없고 배를 여는 수술이 필요 없으며 관리하기가 편할 뿐 아니라 환자들의 적응도가 높다는 장점이 있습니다. 그러나 복수가 있는 환자나 혈액 응고에 장애가 있는 환자, 중요한 혈관 가까이 있는 농양에서는 주의가 필요합니다. 복수가 있는 경우 배액관을 따라 복수가 흘러나오고 농양이 복수를 통해 복강 내로 퍼질 위험이 있습니다. 혈액 응고에 장애가 있는 경우 배액관을 집어넣는 과정만으로도 출혈이 생겨 위험할 수 있습니다. 중요한 혈관 가까이 있는 경우 혈관 손상이 생겨 생명에 위험이 있을 수 있습니다. 이러한 배액술은 모든 간농양에서 시행할 수 있는 것은 아닙니다. 경피 배액이 실패할 수 있는 요인들은 다음과 같습니다. 다발성, 크거나 소포체의 농양, 카테터를 잘 막을 수 있는 점착성의 농양, 일차적으로 수술적 치료를 필요로 하는 질환이 동반하는 경우 (예, 담도계 질환) 등이 있습니다. 기생충성(아메바성) 간농양의 치료는 항아메바성 약물 치료가 원칙으로 90% 이상 성공합니다. 항아메바성 약물로 3~5일 동안 치료하였는데도 반응을 하지 않거나, 간농양에 세균까지 감염이 합병된 경우, 간좌엽에 있어 파열의 위험이 큰 경우 등에서는 경피적 배액술을 시행합니다. 2. 수술적 치료 ? 경피적 배액술이 기술적으로 어려운 경우 ? 수술이 필요한 담도계 질환 등이 있는 경우 ? 농양이 파열되어 다발성 복막염이 된 경우 ? 장관과 간농양이 연결된 경우 ? 경피적 배액술을 시도하였지만 실패한 경우 ? 4-7일내 경피적 배액에 대한 임상적인 반응이 없을 때 ? 다중격 간농양 등이 있을 때에는 수술적 배액술을 하게 되며 응급 수술이 필요한 경우에도 수술적 배액술을 하게 됩니다. 드물게 간을 절제해야 할 때도 있습니다. "
간염,"바이러스 간염이란 바이러스 감염으로 인해 간 조직에 염증이 생기고, 다양한 증상이 나타나는 질환을 말합니다.","바이러스 간염의 원인  바이러스 간염의 주요 발생 원인은 A형, B형, C형, D형 및 E형 간염 바이러스입니다. B형간염과 C형간염은 급성 간염 이후에 만성 간염으로 진행할 수 있는데 반해 A형간염과 E형간염은 급성 간염에서 만성 간염으로 진행하지 않습니다.     B형간염의 감염 경로 B형간염은 감염된 혈액에 노출되거나, 감염된 사람과의 성행위, 출산 도중에 모체로부터(자연 분만이나 제왕 절개 모두 가능) 전염됩니다. 지금까지 밝혀진 B형간염의 전염 경로는 혈액, 정액, 타액(침)입니다. 대변이나 소변, 땀 등을 통한 전염은 아직까지 증명되지 않았습니다. B형간염 바이러스 보유자의 피가 상처 난 피부, 입안, 질 내부에 묻으면 감염될 수 있으며 보유자의 피가 묻어 있는 주사 바늘에 건강한 사람이 찔리면 감염될 수 있습니다. 성접촉을 통해, 또는 칫솔이나 면도기를 함께 쓰는 경우에도 감염될 수 있습니다. 단, B형간염 바이러스에 대한 항체를 보유한 사람은 감염 위험이 없습니다.  C형간염의 감염 경로  주사기를 공동으로 사용하거나 수혈, 혈액 투석, 성접촉, 모자간 수직 감염 등으로 전파되나 40% 정도에서는 감염 경로가 불분명한 상태입니다. ","바이러스 간염의 주요 증상은 피로감, 졸음 및 식욕 부진같은 비특이적인 전신 증상과 함께, 짙은 갈색 소변과 눈의 흰자위와 피부가 노랗게 변하는 황달과 오른쪽 상복부의 통증같은 간염의 특징적인 증상이 있습니다.   만성 바이러스 간염의 증상은 무증상 감염에서부터 말기 간부전까지 다양합니다. 만성 간염으로 진행한 환자의 대부분은 서서히 증상을 경험하게 됩니다. 1. 만성 간염의 일반적인 증상 만성 바이러스 간염의 증상은 무증상 감염에서부터 말기 간부전까지 다양합니다. 만성 간염 초기에는 대부분 특별한 증상이 없으며 질환이 진행하면서 서서히 증상을 경험하게 됩니다. 간염과 관련된 증상으로는 만성 피로가 가장 흔합니다. 만성 간염이 진행된 경우 간헐적 또는 지속적 황달이 오게 되며 식욕 부진, 구역 또는 구토를 호소하는 경우도 있습니다.  2. 만성 간염의 합병증과 관련된 증상  1) 간경화(간경변증)의 증상  간경화(간경변증)로 인해 발생하는 대표적인 증상인 황달은 짙은 갈색 소변과 눈의 흰자위와 피부가 노랗게 변하는 증상을 말합니다. 복수가 차면 복부 팽만감을 느끼게 되고 이로 인해 식욕 부진이 더욱 심해지기도 합니다. 간경화(간경변증)가 진행하면서 식도 또는 위 정맥이 늘어나는 정맥류가 발생하기도 하며, 이는 간경화(간경변증) 환자에서 심각한 위장관 출혈의 원인이 됩니다. 또한 간 기능이 나빠지면서 간성 혼수가 발생하기도 하는데 시간, 장소, 사람에 대한 지남력이 떨어지고 심한 경우 의식이 흐려지는 증상이 발생하기도 합니다.  2) 간암(간세포암종)의 증상  진행성 간암으로 진행하기 전까지는 간암 환자의 대부분은 간암과 관련된 특별한 증상을 느끼지 않습니다. 간암이 진행하면서 식욕 부진이 심해져서 식사량이 줄고 이에 따라 체중이 감소하는 경우도 있으나, 간경화(간경변증)가 동반된 경우가 많아 복수가 차면 체중이 오히려 늘게 되는 경우도 있습니다. 증상이 발현하는 진행 간암 상태로 진단되는 경우, 효과적인 치료를 기대하기 어렵고 임상 경과가 매우 좋지 못하므로 간암의 고위험군인 만성 간염 환자는 주기적인 간암 감시 검사를 반드시 받아야 합니다. ","만성 B형간염은 B형간염 바이러스 표면 항원이 6개월 이상 양성인 경우를 말합니다. B형간염 바이러스 표면 항원은 혈액 검사를 통해 검출하며 이 검사만으로 B형간염을 진단할 수 있습니다.  만성 C형간염의 진단을 위해서는 일차 선별 검사로 C형간염 바이러스에 대한 항체를 검출하며, C형간염 바이러스 RNA 검사를 통해 진단합니다.  1. B형간염의 진단 B형간염은 B형간염 바이러스 표면 항원(HBsAg)을 혈액에서 검출하는 혈액 검사를 통해 진단하는데, 이 검사만으로 B형간염을 진단할 수 있습니다. 만성 B형간염은 표면 항원이 6개월 이상 양성인 경우를 말합니다. 만성 B형간염 환자에서는 B형간염 바이러스 증식 정도를 평가하는 것이 매우 중요합니다. 바이러스의 증식 정도를 평가하기 위해 e항원/e항체(HBeAg/anti-HBe) 검사, 혈청 B형간염 바이러스 DNA 정량 검사를 시행합니다. 만성 B형 간염은 간 효소 수치, 혈액 내 바이러스(혈청 HBV DNA) 수치, 표면 항원 검사 결과에 따라 면역 관용기, e항원(HBeAg) 양성 면역 활동기, 면역 비활동기, e항원(HBeAg) 음성 면역 활동기, 표면 항원(HBsAg) 소실기로 나뉘어집니다. 2. C형간염의 진단 C형간염 여부 확인을 위해 일차 선별 검사로 C형간염 바이러스에 대한 항체(HCV 항체)를 검출하는 검사를 시행합니다. 혈액에서 C형간염 바이러스에 대한 항체가 검출되는 경우, C형간염의 진단을 위해서는 C형간염 바이러스 RNA 검사(HCV RNA 검사)를 시행합니다. 실시간 중합 효소 연쇄 반응법(real-time PCR, Polymerase Chain Reaction)을 이용하여 매우 적은 양의 HCV RNA도 검출할 수 있으며 C형간염의 진단 및 치료 반응 평가에 널리 사용하고 있습니다. 6개월 이상 C형간염이 지속되는 경우 만성 C형간염으로 진단할 수 있습니다. 일반적으로 HCV RNA 검사와 함께 C형간염 바이러스 유전자형 검사를 시행하여 항바이러스 치료 반응 예측 등에 활용하게 됩니다. ","만성 B형간염은 항바이러스 치료를 통해 완치를 기대할 수 없으며 오랜 기간의 치료가 필요합니다. 따라서 적절한 치료 대상을 선별하여 내성 발현 위험이 낮은 약제를 투여하는 것이 중요합니다.   항바이러스 치료를 통해 C형간염 바이러스 박멸이 가능하기 때문에 치료 금기가 없는 모든 C형간염 환자는 치료를 고려해야 합니다. 최근 경구 항바이러스제는 부작용이 적으면서도 효과가 좋아 널리 사용되고 있습니다.  1. 급성 바이러스 간염의 치료 급성 바이러스 간염에 대한 특이적인 치료법은 없으며, 일반적으로 영양 수액 주사, 절대적 안정과 같은 치료에 의존하게 됩니다. 이전에 건강했던 젊은 환자에게는 절대적 안정은 필요하지 않으나 황달이나 구역 및 식욕 부진과 같은 증상이 심한 경우 적절한 수분과 영양 공급을 위해 영양 수액 주사 요법을 시행하면서 휴식을 취하게 합니다. 식이 요법으로는 적절한 고단백, 고칼로리 식단이 권장됩니다. B형간염의 경우 급성 간염에 걸린 성인 환자의 대부분은 급성 간염에서 회복되는 반면, C형 간염의 경우 성인 환자의 대부분이 만성 간염으로 진행하게 되므로 추적 검사를 통해 만성 간염으로 진행하는지 확인해야 합니다. 2. 만성 B형간염의 치료 1) 만성B형간염 치료의 일반 원칙 만성 B형간염 환자에서 항바이러스 치료의 궁극적인 목적은 지속적으로 바이러스의 증식을 억제하고 간의 염증을 완화시켜 섬유화가 간경화(간경변증)로 진행하지 않도록 하는 것입니다. 또한, 간암 발생을 예방함으로써 간 질환에 의한 사망률을 낮추고 생존율을 향상시키는 것입니다. 현재까지는 효과적인 항바이러스 치료에도 불구하고 B형간염 바이러스를 완전히 제거할 수 없기 때문에 지속적으로 바이러스가 증식하지 않도록 하는 것이 중요합니다. 2) 만성 B형간염을 치료해야 하는 경우 간 효소 수치, 혈액 내 바이러스(혈청 HBV DNA) 수치, 표면 항원 검사 결과에 따라 치료 여부를 결정합니다. e항원(HBeAg) 양성이며, 혈액 내 바이러스 수치가 매우 높더라도 지속적으로 정상 알라닌 아미노기 전달 효소(alanine aminotransferase, ALT) 수치를 보이며, 간경화(간경변증)가 뚜렷하지 않은 경우는 항바이러스 치료의 대상이 아닙니다. 혈액 내 바이러스 수치가 높고 ALT 수치가 정상 상한치의 2배 이상으로 상승한 경우에는 항바이러스 치료를 시작합니다. 이 때, e항원 상태에 따라 혈청 HBV DNA 수치의 기준이 다릅니다. 심한 간경화(간경변증)로 진행했거나 간암을 진단받은 만성 B형간염 환자에서는 ALT 수치가 정상 범위 내에 있다고 하더라도 혈액 내 바이러스 증식이 확인되면 즉시 치료를 시작해야 합니다. 대한간학회에서 제시한 치료 기준은 다음과 같습니다.     3) 만성 B형간염 치료에 쓰이는 약제  항바이러스 치료가 필요한 만성 B형간염 환자에서는 경구용 항바이러스제를 이용한 치료를 우선 고려합니다. 인터페론 주사 치료도 시도할 수 있으나 B형간염 바이러스 중 특정 유전자형(C형)이 많은 우리나라 환자에서는 효과가 제한적이므로 널리 사용하고 있지는 않습니다. 경구용 항바이러스제는 약제에 대한 내성이 발현할 가능성이 낮은 약제를 선택하는 것이 중요합니다. 이전에 항바이러스제를 복용한 적이 없는 만성 B형간염 환자에서는 내성 발현 가능성이 낮은 엔테카비르(entecavir), 테노포비르DF(tenofovir disoproxil fumarate), 테노포비르AF(tenofovir alafenamide), 베시포비르(besifovir) 중 한 가지 약제를 선택하여 복용하게 됩니다. 이미 항바이러스제에 내성을 보이는 환자에서는 두 가지 항바이러스제를 함께 복용하는 경우도 있습니다. 3. 만성 C형간염의 치료 1) 만성 C형간염 치료의 일반 원칙 C형간염 치료의 목표는 C형간염 바이러스를 박멸하여 간경화 진행을 예방하고 간암(간세포암종) 및 C형간염 바이러스 감염으로 인한 간 외 합병증의 발생 위험을 줄여서 궁극적으로 C형간염으로 인한 사망률을 낮추는 것입니다. 만성 C형간염 환자는 치료를 할 수 없는 일부 환자를 제외하고 누구나 치료의 대상이 됩니다. 그러나 수십 년에 걸쳐 서서히 진행하는 C형간염의 자연 경과와 치료 목표를 고려하여 치료에 따르는 이득이 치료의 위험에 비해 클수록 보다 적극적으로 치료하게 됩니다. 2) 만성 C형간염을 치료해야 하는 경우 치료 금기가 없는 모든 C형간염 환자는 치료를 고려해야 합니다. 섬유화가 진행된 환자와 간 이식 전후 환자, 혼합 한랭 글로불린 혈증, 사구체 신염 등의 C형간염과 연관된 심각한 간 외 합병증을 동반한 환자는 우선적으로 치료합니다. 다만, 만성 C형간염 이외의 중증 질환이 있어 기대 여명이 짧은 환자들에게는 항바이러스 치료를 권유하지 않습니다. 3) 만성 C형간염 치료에 쓰이는 약제 최근 경구 항바이러스제가 개발되어 사용되면서 C형간염 치료의 틀이 빠르게 변화하고 있습니다. 과거 치료에 사용했던 페그인터페론 알파 및 리바비린 병합 요법은 최근에는 거의 사용되고 있지 않으며, 특수 상황에 있는 환자에서 고려할 수 있습니다. 경구 항바이러스제에는 레디파스비르/소포스부비르(ledipasvir/sofosbuvir), 다클라타스비르(daclatasvir), 아수나프레비르(asunaprevir), 옴비타스비르/파리타프레비르/리토나비르(ombitasvir/paritaprevir/ritonavir), 다사부비르(dasabuvir), 엘바스비르/그라조프레비르(elbasvir/grazoprevir), 글레카프레비르/피브렌타스비르(glecaprevir/pibrentasvir), 소포스부비르/벨파타스비르(sofosbuvir/velpatasvir), 소포스부비르/벨파타스비르/복실라프레비르(sofosbuvir/velpatasvir/voxilaprevir)와 같은 여러 종류의 약제가 포함됩니다. 환자의 상태와 유전자형, 복용하고 있는 다른 약제와의 상호 작용 여부 등을 여러 방면으로 고려하여 약제를 선택합니다. 치료 기간은 간경화(간경변증) 동반 여부, 간 이식 여부, 약제 종류에 따라 결정합니다. "
